3;Sapatilha Onça c/ Fivela Laço;Sapatilha Onça c/ Fivela Laço;Tamanho: 34 ao 39;25;20;IMG086.jpg;0
3;Sapatilha couro sint. c Fivela;Sapatilha couro sintético c/ Fivela;Tamanho: 34 ao 39;25;20;IMG087.jpg;0
3;Sapatilha couro sint. c Fivela;Sapatilha couro sintético c/ Fivela;Tamanho: 34 ao 39;25;20;IMG088.jpg;0
3;Sapatilha floral c/ Slip;Sapatilha floral c/ Slip;Tamanho: 34 ao 39;25;20;IMG089.jpg;0
3;Sapatilha Camursa det. Dourado;Sapatilha Camursa c/ ponta dourada;Tamanho: 34 ao 39|Várias Cores;25;20;IMG090.jpg;0
3;Sapatilha Slip c/ Brilho;Sapatilha Slip c/ Brilho;Tamanho: 34 ao 39;25;20;IMG091.jpg;0
3;Sapatilha slip de onça;Sapatilha slip de onça;Tamanho: 34 ao 39;25;20;IMG092.jpg;0
3;Sapatilha camursa c/ spike;Sapatilha camursa c/ spike;Tamanho: 34 ao 39;25;20;IMG093.jpg;0
3;Sapatilha camursa c/ spike;Sapatilha camursa c/ spike;Tamanho: 34 ao 39;25;20;IMG094.jpg;0
3;Sapatilha Gladiadora;Sapatilha Gladiadora;Tamanho: 34 ao 39;25;20;IMG095.jpg;0
3;Sandália Gladiadora floral;Sandália Gladiadora floral;Tamanho: 34 ao 39;20;18;IMG096.jpg;0
3;Rasteira com Elástico;Rasteira com Elástico;Tamanho: 34 ao 39;13;10;IMG097.jpg;0
3;Rasteira com Elástico;Rasteira com Elástico;Tamanho: 34 ao 39;13;10;IMG098.jpg;0
